{
  "profile_id": "ec137_a500_c40",
  "name": "顿力 EC137-A500-C40",
  "device_model": "ec_fan",
  "description": "顿力 EC137-A500-C40 EC 风机节点。19200 8N1，节点 ID 1/2；FC03 读保持寄存器、FC04 读输入寄存器、FC06 写单寄存器。",
  "source": {
    "directory": "/home/dyh/code/hardware/ems/hp-52kw/App/User",
    "file": "ec_fan_comm.c",
    "protocol": "hp-52kw EC fan communication implementation"
  },
  "slave_id": 1,
  "baudrate": 19200,
  "serial": {
    "bytesize": 8,
    "parity": "N",
    "stopbits": 1
  },
  "function_codes": [3, 4, 6],
  "per_slave_addresses": [53248, 53249, 53264, 53265, 53266, 53267, 53268, 53505, 53529, 53612],
  "status_fields": [
    {"label": "目标转速原始值", "kind": "register", "address": 53249},
    {"label": "电机状态", "kind": "register", "address": 53265},
    {"label": "转速原始值", "kind": "register", "address": 53264}
  ],
  "registers": [
    {
      "address": 53248,
      "address_label": "D000 (0xD000)",
      "name": "故障复位",
      "key": "d000_fault_reset",
      "access": "rw",
      "register_type": "hold",
      "data_type": "u16",
      "default_raw": 0,
      "min_raw": 0,
      "max_raw": 15,
      "unit": "",
      "precision": "",
      "transfer": "bit2=1 触发故障复位，正常 FC06 回显后自动恢复 0",
      "enum": {"0": "无操作", "4": "故障复位(bit2)"},
      "description": "D000 (0xD000)；保持寄存器；写入 bit2=1 请求 EC 风机清除故障。成功 FC06 回显生成后，本模拟器清除同一节点 D011 并将 D000 恢复为 0。",
      "source": {"file": "App/User/ec_fan_comm.c", "line": 12, "protocol_constant": "EC_FAN_REG_FAULT_RESET"}
    },
    {
      "address": 53249,
      "address_label": "D001 (0xD001)",
      "name": "目标转速",
      "key": "d001_target_speed",
      "access": "rw",
      "register_type": "hold",
      "data_type": "u16",
      "default_raw": 0,
      "min_raw": 0,
      "max_raw": 65535,
      "unit": "",
      "precision": "",
      "transfer": "raw = rpm * 64000 / 925，超出 uint16 饱和",
      "enum": {},
      "description": "D001 (0xD001)；保持寄存器；目标转速原始 uint16 值。hp-52kw 主控将 rpm 按 raw=rpm*64000/925 换算后写入。",
      "source": {"file": "App/User/ec_fan_comm.c", "line": 13, "protocol_constant": "EC_FAN_REG_TARGET_SPEED"}
    },
    {
      "address": 53264,
      "address_label": "D010 (0xD010)",
      "name": "转速",
      "key": "d010_speed",
      "access": "r",
      "register_type": "input",
      "data_type": "u16",
      "default_raw": 0,
      "min_raw": 0,
      "max_raw": 65535,
      "unit": "",
      "precision": "",
      "transfer": "rpm = raw * 925 / 64000（整数截断）",
      "enum": {},
      "description": "D010 (0xD010)；输入寄存器；风机转速原始 uint16 值。",
      "source": {"file": "App/User/ec_fan_comm.c", "line": 14, "protocol_constant": "EC_FAN_REG_TELEMETRY[0]"}
    },
    {
      "address": 53265,
      "address_label": "D011 (0xD011)",
      "name": "电机状态",
      "key": "d011_motor_status",
      "access": "r",
      "register_type": "input",
      "data_type": "u16",
      "default_raw": 0,
      "min_raw": 0,
      "max_raw": 65535,
      "unit": "",
      "precision": "",
      "transfer": "原始 uint16 状态码",
      "enum": {},
      "description": "D011 (0xD011)；输入寄存器；电机状态/故障原始 uint16 值。",
      "source": {"file": "App/User/ec_fan_comm.c", "line": 14, "protocol_constant": "EC_FAN_REG_TELEMETRY[1]"}
    },
    {
      "address": 53266,
      "address_label": "D012 (0xD012)",
      "name": "警告",
      "key": "d012_warning",
      "access": "r",
      "register_type": "input",
      "data_type": "u16",
      "default_raw": 0,
      "min_raw": 0,
      "max_raw": 65535,
      "unit": "",
      "precision": "",
      "transfer": "原始 uint16 状态码",
      "enum": {},
      "description": "D012 (0xD012)；输入寄存器；风机警告原始 uint16 值。",
      "source": {"file": "App/User/ec_fan_comm.c", "line": 14, "protocol_constant": "EC_FAN_REG_TELEMETRY[2]"}
    },
    {
      "address": 53267,
      "address_label": "D013 (0xD013)",
      "name": "输入电压",
      "key": "d013_voltage",
      "access": "r",
      "register_type": "input",
      "data_type": "u16",
      "default_raw": 0,
      "min_raw": 0,
      "max_raw": 65535,
      "unit": "V",
      "precision": "5/256",
      "transfer": "voltage = raw * 5 / 256 V",
      "enum": {},
      "description": "D013 (0xD013)；输入寄存器；输入电压原始值，主控换算为 raw*5/256 V。",
      "source": {"file": "App/User/ec_fan_comm.c", "line": 14, "protocol_constant": "EC_FAN_REG_TELEMETRY[3]"}
    },
    {
      "address": 53268,
      "address_label": "D014 (0xD014)",
      "name": "输入电流",
      "key": "d014_current",
      "access": "r",
      "register_type": "input",
      "data_type": "u16",
      "default_raw": 0,
      "min_raw": 0,
      "max_raw": 65535,
      "unit": "A",
      "precision": "0.2/256",
      "transfer": "current = raw * 0.2 / 256 A",
      "enum": {},
      "description": "D014 (0xD014)；输入寄存器；输入电流原始值，主控换算为 raw*0.2/256 A。",
      "source": {"file": "App/User/ec_fan_comm.c", "line": 14, "protocol_constant": "EC_FAN_REG_TELEMETRY[4]"}
    },
    {
      "address": 53505,
      "address_label": "D101 (0xD101)",
      "name": "调速方式",
      "key": "d101_speed_way",
      "access": "rw",
      "register_type": "hold",
      "data_type": "u16",
      "default_raw": 0,
      "min_raw": 0,
      "max_raw": 3,
      "unit": "",
      "precision": "",
      "transfer": "原始枚举值",
      "enum": {"0": "协议默认", "1": "主控调速"},
      "description": "D101 (0xD101)；保持寄存器；调速方式配置。协议默认 0，hp-52kw 运行配置写入 1。",
      "source": {"file": "App/User/ec_fan_comm.c", "line": 15, "protocol_constant": "EC_FAN_REG_SPEED_WAY"}
    },
    {
      "address": 53529,
      "address_label": "D119 (0xD119)",
      "name": "最大转速",
      "key": "d119_max_speed",
      "access": "rw",
      "register_type": "hold",
      "data_type": "u16",
      "default_raw": 3500,
      "min_raw": 0,
      "max_raw": 3500,
      "unit": "rpm",
      "precision": "1",
      "transfer": "原始 rpm 值",
      "enum": {},
      "description": "D119 (0xD119)；保持寄存器；最大转速配置。协议默认 3500，hp-52kw 运行配置写入 925。",
      "source": {"file": "App/User/ec_fan_comm.c", "line": 16, "protocol_constant": "EC_FAN_REG_MAX_SPEED"}
    },
    {
      "address": 53612,
      "address_label": "D16C (0xD16C)",
      "name": "调速信号源",
      "key": "d16c_speed_source",
      "access": "rw",
      "register_type": "hold",
      "data_type": "u16",
      "default_raw": 1,
      "min_raw": 0,
      "max_raw": 3,
      "unit": "",
      "precision": "",
      "transfer": "原始枚举值",
      "enum": {"0": "主控信号", "1": "协议默认"},
      "description": "D16C (0xD16C)；保持寄存器；调速信号源配置。协议默认 1，hp-52kw 运行配置写入 0。",
      "source": {"file": "App/User/ec_fan_comm.c", "line": 17, "protocol_constant": "EC_FAN_REG_SPEED_SOURCE"}
    }
  ],
  "coils": []
}
