{
  "profile_id": "compressor_inverter_v24",
  "name": "厂家压缩机变频器 V2.4",
  "device_model": "compressor_inverter",
  "description": "热泵压缩机变频器 V2.4。9600 8N2；节点 ID 1/2；FC03 读保持寄存器、FC06 写单寄存器。",
  "source": {
    "protocol": "Compressor inverter communication protocol V2.4",
    "firmware": "hp-52kw UART.c / RS485_Usart2_init"
  },
  "slave_id": 1,
  "baudrate": 9600,
  "serial": {
    "bytesize": 8,
    "parity": "N",
    "stopbits": 2
  },
  "function_codes": [3, 6],
  "per_slave_addresses": [24581, 24582, 24584, 24585, 24586, 24587, 24591, 24598, 32768, 32769],
  "status_fields": [
    {"label": "母线电压", "kind": "register", "address": 24581, "scale": 1, "suffix": " V"},
    {"label": "输出频率", "kind": "register", "address": 24582, "scale": 10, "suffix": " Hz"},
    {"label": "输出电流", "kind": "register", "address": 24584, "scale": 10, "suffix": " A"},
    {"label": "输出转矩", "kind": "register", "address": 24585, "scale": 1, "suffix": " %"},
    {"label": "输出电压", "kind": "register", "address": 24586, "scale": 1, "suffix": " V"},
    {"label": "输出功率", "kind": "register", "address": 24587, "scale": 10, "suffix": " kW"},
    {"label": "故障代码", "kind": "register", "address": 24591, "scale": 1, "suffix": ""},
    {"label": "变频器温度", "kind": "register", "address": 24598, "scale": 1, "suffix": " °C"}
  ],
  "registers": [
    {
      "address": 24581,
      "address_label": "0x6005",
      "name": "bus_voltage",
      "key": "bus_voltage",
      "access": "r",
      "register_type": "hold",
      "data_type": "u16",
      "default_raw": 0,
      "min_raw": 0,
      "max_raw": 65535,
      "unit": "V",
      "description": "母线电压，原始值单位 1 V。"
    },
    {
      "address": 24582,
      "address_label": "0x6006",
      "name": "output_frequency",
      "key": "output_frequency",
      "access": "r",
      "register_type": "hold",
      "data_type": "u16",
      "default_raw": 0,
      "min_raw": 0,
      "max_raw": 65535,
      "unit": "0.1 Hz",
      "description": "输出频率，原始值单位 0.1 Hz；固件读取后取绝对值。"
    },
    {
      "address": 24584,
      "address_label": "0x6008",
      "name": "output_current",
      "key": "output_current",
      "access": "r",
      "register_type": "hold",
      "data_type": "u16",
      "default_raw": 0,
      "min_raw": 0,
      "max_raw": 65535,
      "unit": "0.1 A",
      "description": "输出电流，原始值单位 0.1 A。"
    },
    {
      "address": 24585,
      "address_label": "0x6009",
      "name": "output_torque",
      "key": "output_torque",
      "access": "r",
      "register_type": "hold",
      "data_type": "u16",
      "default_raw": 0,
      "min_raw": 0,
      "max_raw": 65535,
      "unit": "0.1%",
      "description": "输出转矩，原始值单位 0.1%。"
    },
    {
      "address": 24586,
      "address_label": "0x600A",
      "name": "output_voltage",
      "key": "output_voltage",
      "access": "r",
      "register_type": "hold",
      "data_type": "u16",
      "default_raw": 0,
      "min_raw": 0,
      "max_raw": 65535,
      "unit": "V",
      "description": "输出电压，原始值单位 1 V。"
    },
    {
      "address": 24587,
      "address_label": "0x600B",
      "name": "output_power",
      "key": "output_power",
      "access": "r",
      "register_type": "hold",
      "data_type": "u16",
      "default_raw": 0,
      "min_raw": 0,
      "max_raw": 65535,
      "unit": "0.1 kW",
      "description": "输出功率，原始值单位 0.1 kW。"
    },
    {
      "address": 24591,
      "address_label": "0x600F",
      "name": "fault_code",
      "key": "fault_code",
      "access": "r",
      "register_type": "hold",
      "data_type": "u16",
      "default_raw": 0,
      "min_raw": 0,
      "max_raw": 65535,
      "description": "变频器故障代码。"
    },
    {
      "address": 24598,
      "address_label": "0x6016",
      "name": "inverter_temperature",
      "key": "inverter_temperature",
      "access": "r",
      "register_type": "hold",
      "data_type": "i16",
      "default_raw": 0,
      "min_raw": 0,
      "max_raw": 65535,
      "unit": "°C",
      "description": "变频器温度，有符号 16 位语义，原始值按标准 16 位大端传输。"
    },
    {
      "address": 32768,
      "address_label": "0x8000",
      "name": "control_word",
      "key": "control_word",
      "access": "rw",
      "register_type": "hold",
      "data_type": "u16",
      "default_raw": 0,
      "min_raw": 0,
      "max_raw": 65535,
      "enum": {"0": "停机", "1025": "启动", "4": "故障复位"},
      "description": "控制字；FC06 写入 0x0401 启动、0x0000 停机、0x0004 故障复位。复位值不自动清除。"
    },
    {
      "address": 32769,
      "address_label": "0x8001",
      "name": "frequency_setpoint",
      "key": "frequency_setpoint",
      "access": "rw",
      "register_type": "hold",
      "data_type": "u16",
      "default_raw": 0,
      "min_raw": 0,
      "max_raw": 32767,
      "unit": "0.1 Hz",
      "description": "频率设定，wire value 为目标 Hz × 10，范围 0..32767。"
    }
  ],
  "coils": []
}
